{
  "kind": "pve-template-publish-request",
  "schema_version": 3,
  "artifact": {
    "kind": "image-artifact",
    "schema_version": 1,
    "artifact_id": "external-debian13-example",
    "version": "external-2026-09-23",
    "disk": {
      "path": "disk.qcow2",
      "format": "qcow2",
      "sha256": "bbbbbbbbbbbbbbbbbbbbbbbbbbbbbbbbbbbbbbbbbbbbbbbbbbbbbbbbbbbbbbbb",
      "size_bytes": 1073741824,
      "virtual_size_bytes": 8589934592,
      "self_contained": true
    },
    "guest": {
      "architecture": "amd64",
      "firmware": "bios",
      "cloud_init": "unknown",
      "guest_agent": "unknown"
    },
    "build": {
      "origin": "external"
    },
    "checks": [
      {
        "id": "format",
        "scope": "static",
        "status": "passed",
        "evidence_ref": null
      },
      {
        "id": "self-contained",
        "scope": "static",
        "status": "passed",
        "evidence_ref": null
      },
      {
        "id": "first-boot",
        "scope": "post-cleanup-disposable",
        "status": "unknown",
        "evidence_ref": null
      }
    ]
  },
  "artifact_digest": "sha256:a3cc5759eb5c646c4d290bfc81f25d54ee008e3a67336864a2a4055f739eca85",
  "source": {
    "object_ref": "s3://iaas-images/external-debian13-example.qcow2",
    "object_version": "immutable-v1"
  },
  "target": {
    "api_endpoint": "https://pve.example.invalid:8006",
    "node": "cohe",
    "tls_verify": true
  },
  "vmid": 9000,
  "version": "external-2026-09-23",
  "name": "debian13-general-template",
  "staging_storage": "local",
  "disk_storage": "memory",
  "cloud_init_storage": "memory",
  "hardware": {
    "cpus": 2,
    "memory_mib": 1024,
    "machine": "q35",
    "scsi_controller": "virtio-scsi-single",
    "boot_disk": "scsi0",
    "bridge": null,
    "firmware": "bios"
  },
  "cloud_init_defaults": {
    "user": "debian",
    "ssh_keys": []
  },
  "requirements": {
    "required": [
      {
        "id": "format",
        "scope": "static"
      },
      {
        "id": "self-contained",
        "scope": "static"
      }
    ],
    "optional": [
      {
        "id": "first-boot",
        "scope": "post-cleanup-disposable"
      }
    ],
    "native_template_config_verify": true,
    "guest_acceptance_scope": "caller"
  },
  "transport": "controller-upload",
  "cluster_scope": "example-cluster",
  "pool": null,
  "deadlines": {
    "work_deadline_at": "2099-01-01T00:00:00Z",
    "cleanup_deadline_at": "2099-01-01T00:10:00Z"
  }
}
